<!ELEMENT contacts (contact*) >
<!ATTLIST contacts version CDATA #FIXED "1.0">
<!ATTLIST contacts source CDATA #IMPLIED>
<!ELEMENT contact (name, location, phone, knows, description, website+, email)>
<!ATTLIST contact person ID #REQUIRED>
<!ATTLIST contact GENDER (M|F) "F">
<!ELEMENT name (first+, middle?, last)>
<!ELEMENT first (#PCDATA)>
<!ELEMENT middle (#PCDATA)>
<!ELEMENT last (#PCDATA)>
<!ELEMENT location (address | (latitude, longitude))*>
<!ELEMENT address (#PCDATA)>
<!ELEMENT latitude (#PCDATA)>
<!ELEMENT longitude (#PCDATA)>
<!ELEMENT phone (#PCDATA)>
<!ATTLIST phone kind (Home | Work | Cell | Fax) "Home">
<!ELEMENT knows EMPTY>
<!ELEMENT description (#PCDATA | em | strong | br)*>
<!ELEMENT em (#PCDATA)>
<!ELEMENT strong (#PCDATA)>
<!ELEMENT br EMPTY>
<!ELEMENT website (#PCDATA) >
<!ELEMENT email (#PCDATA) >
